{
  "$schema": "http://json-schema.org/draft-07/schema#",
  "$id": "https://bentrd.github.io/GambonanzaMods/registry/texturepack-schema.json",
  "title": "Gambonanza resource pack registry entry",
  "description": "One file per resource pack in registry/texturepacks/<id>.json. A resource pack is images, sounds, music and wording, never code: the zip holds PNGs, WAVs and a manifest, and the framework applies it at runtime without touching the game's own files. The zip lives on the author's own GitHub release; the registry only records where it is and what it hashed to when a human reviewed it.",
  "type": "object",
  "additionalProperties": false,
  "required": ["id", "name", "author", "summary", "repo", "asset"],
  "properties": {
    "id": {
      "type": "string",
      "pattern": "^[a-z0-9][a-z0-9-]{1,38}[a-z0-9]$",
      "description": "Lowercase letters, digits and dashes. Must match the file name."
    },
    "name": { "type": "string", "minLength": 2, "maxLength": 48 },
    "author": { "type": "string", "minLength": 1, "maxLength": 48 },
    "summary": {
      "type": "string",
      "minLength": 8,
      "maxLength": 140,
      "description": "One line, shown on the pack's card."
    },
    "description": { "type": "string", "maxLength": 4000 },
    "repo": {
      "type": "string",
      "maxLength": 100,
      "pattern": "^[A-Za-z0-9_.-]+/[A-Za-z0-9_.-]+$",
      "description": "owner/name of the GitHub repository whose releases hold the zip. Downloads are pinned to this repo."
    },
    "asset": {
      "type": "string",
      "maxLength": 120,
      "description": "Release asset file name, optionally with * wildcards, e.g. \"midnight-chess-*.zip\"."
    },
    "tagPattern": {
      "type": "string",
      "maxLength": 60,
      "description": "Which release tags count, e.g. \"pack-v*\". Defaults to every tag."
    },
    "prerelease": { "type": "boolean", "default": false },
    "homepage": { "type": "string", "pattern": "^https://", "maxLength": 200 },
    "preview": {
      "type": "string",
      "pattern": "^https://raw\\.githubusercontent\\.com/",
      "maxLength": 300,
      "description": "A screenshot of the pack in the game. raw.githubusercontent.com only - it is the one image host the manager's renderer allows."
    },
    "tags": {
      "type": "array",
      "maxItems": 5,
      "items": { "enum": ["visual", "ui", "audio", "gameplay", "quality-of-life", "tools"] }
    },
    "gameVersion": { "type": "string", "maxLength": 40 },
    "pending": {
      "type": "boolean",
      "description": "Accepted before the first release exists; the index refresh picks it up when the zip appears."
    },
    "submittedBy": { "type": "string", "maxLength": 48 },
    "addedAt": { "type": "string", "pattern": "^[0-9]{4}-[0-9]{2}-[0-9]{2}$" }
  }
}
