{
  "id": "dracula-botezzaro",
  "name": "Dracula Botezzaro",
  "author": "FRO_PWR",
  "summary": "Re-skins the boss Botezzaro into Count Dracula from Castlevania.",
  "description": "Re-skins the Botezzaro boss sprite sheet into Count Dracula from the Castlevania series, and renames him \"Count Dracula, Lord of a Dark Kingdom\" in every language.",
  "repo": "Agent15/Gambit_PWR_PACK",
  "asset": "Dracula_Botezzaro.zip",
  "preview": "https://raw.githubusercontent.com/Agent15/Gambit_PWR_PACK/main/Reskins/Dracula_Botezzaro/tp-df89a7f6/images/spr-onikaru-v2.png",
  "tags": [
    "visual"
  ],
  "submittedBy": "Agent15",
  "addedAt": "2026-09-28"
}
