{
  "id": "w-d-gaster",
  "name": "W. D. Gaster",
  "author": "Minty",
  "summary": "Reskins Judit Polgeisha",
  "description": "Re-skins Judit Polgeisha as W. D. Gaster, with replacement body, puppet, fan and portrait artwork. Includes seventeen boss sound replacements and changes the boss name, subtitle and lore in every language.",
  "repo": "Craftyman6/Mintys-Custom-Gambits",
  "asset": "W._D._Gaster.zip",
  "preview": "https://raw.githubusercontent.com/Craftyman6/Mintys-Custom-Gambits/main/ResoursePacks/W._D._Gaster/tp-9ffd95f1/images/boss-2.png",
  "homepage": "https://github.com/Craftyman6/Mintys-Custom-Gambits/tree/main/ResoursePacks/W._D._Gaster/tp-9ffd95f1",
  "tags": [
    "visual",
    "audio"
  ],
  "submittedBy": "Craftyman6",
  "addedAt": "2026-10-13"
}
